{
  "schema_version": 6,
  "route": "exact-native-v6",
  "atlas_size": [
    3502,
    88
  ],
  "palette_file": "palette.json",
  "body_preview": "preview/yone_v6_actor_card.png",
  "frames": [
    {
      "action": "skill2",
      "index": 0,
      "file": "frames/skill2_00.png",
      "rect": [
        1970,
        0,
        31,
        49
      ],
      "bottom_margin": 5,
      "face_bbox": [
        15,
        14,
        6,
        6
      ],
      "eye_pixels": [
        [
          16,
          17
        ]
      ],
      "mask_bbox": [
        5,
        8,
        10,
        10
      ],
      "foot_zones": [
        [
          4,
          40,
          20,
          4
        ]
      ],
      "face_visibility": "profile"
    },
    {
      "action": "hit",
      "index": 0,
      "file": "frames/hit_00.png",
      "rect": [
        874,
        0,
        43,
        53
      ],
      "bottom_margin": 15,
      "face_bbox": [
        15,
        7,
        8,
        10
      ],
      "eye_pixels": [
        [
          21,
          8
        ]
      ],
      "mask_bbox": [
        2,
        3,
        10,
        15
      ],
      "foot_zones": [
        [
          2,
          34,
          35,
          4
        ]
      ],
      "face_visibility": "profile"
    },
    {
      "action": "attack",
      "index": 0,
      "file": "frames/attack_00.png",
      "rect": [
        544,
        0,
        45,
        51
      ],
      "bottom_margin": 14,
      "face_bbox": [
        20,
        10,
        7,
        7
      ],
      "eye_pixels": [
        [
          21,
          13
        ],
        [
          25,
          13
        ]
      ],
      "mask_bbox": [
        10,
        4,
        10,
        10
      ],
      "foot_zones": [
        [
          7,
          33,
          25,
          4
        ]
      ],
      "face_visibility": "front"
    },
    {
      "action": "attack",
      "index": 1,
      "file": "frames/attack_01.png",
      "rect": [
        590,
        0,
        49,
        51
      ],
      "bottom_margin": 14,
      "face_bbox": [
        24,
        10,
        7,
        11
      ],
      "eye_pixels": [
        [
          26,
          14
        ]
      ],
      "mask_bbox": [
        14,
        4,
        12,
        15
      ],
      "foot_zones": [
        [
          12,
          33,
          22,
          4
        ]
      ],
      "face_visibility": "profile"
    },
    {
      "action": "attack",
      "index": 2,
      "file": "frames/attack_02.png",
      "rect": [
        640,
        0,
        59,
        47
      ],
      "bottom_margin": 12,
      "face_bbox": [
        29,
        9,
        7,
        8
      ],
      "eye_pixels": [
        [
          31,
          12
        ],
        [
          34,
          12
        ]
      ],
      "mask_bbox": [
        19,
        4,
        9,
        10
      ],
      "foot_zones": [
        [
          16,
          31,
          34,
          4
        ]
      ],
      "face_visibility": "front"
    },
    {
      "action": "attack",
      "index": 3,
      "file": "frames/attack_03.png",
      "rect": [
        700,
        0,
        59,
        49
      ],
      "bottom_margin": 13,
      "face_bbox": [
        28,
        10,
        7,
        7
      ],
      "eye_pixels": [
        [
          30,
          13
        ]
      ],
      "mask_bbox": [
        18,
        4,
        10,
        11
      ],
      "foot_zones": [
        [
          16,
          32,
          30,
          4
        ]
      ],
      "face_visibility": "profile"
    },
    {
      "action": "attack",
      "index": 4,
      "file": "frames/attack_04.png",
      "rect": [
        760,
        0,
        61,
        49
      ],
      "bottom_margin": 13,
      "face_bbox": [
        34,
        10,
        7,
        7
      ],
      "eye_pixels": [
        [
          36,
          13
        ]
      ],
      "mask_bbox": [
        24,
        4,
        10,
        11
      ],
      "foot_zones": [
        [
          13,
          32,
          37,
          4
        ]
      ],
      "face_visibility": "profile"
    },
    {
      "action": "attack",
      "index": 5,
      "file": "frames/attack_05.png",
      "rect": [
        822,
        0,
        51,
        51
      ],
      "bottom_margin": 14,
      "face_bbox": [
        27,
        11,
        6,
        9
      ],
      "eye_pixels": [
        [
          31,
          15
        ],
        [
          28,
          14
        ]
      ],
      "mask_bbox": [
        14,
        4,
        15,
        17
      ],
      "foot_zones": [
        [
          6,
          33,
          39,
          4
        ]
      ],
      "face_visibility": "front"
    },
    {
      "action": "skill2_dash",
      "index": 0,
      "file": "frames/skill2_dash_00.png",
      "rect": [
        2002,
        0,
        43,
        43
      ],
      "bottom_margin": 4,
      "face_bbox": [
        24,
        13,
        6,
        7
      ],
      "eye_pixels": [
        [
          28,
          16
        ]
      ],
      "mask_bbox": [
        11,
        6,
        15,
        15
      ],
      "foot_zones": [
        [
          3,
          35,
          37,
          4
        ]
      ],
      "face_visibility": "profile"
    },
    {
      "action": "ult",
      "index": 0,
      "file": "frames/ult_00.png",
      "rect": [
        2288,
        0,
        49,
        51
      ],
      "bottom_margin": 5,
      "face_bbox": [
        23,
        17,
        6,
        7
      ],
      "eye_pixels": [
        [
          24,
          20
        ]
      ],
      "mask_bbox": [
        13,
        12,
        10,
        10
      ],
      "foot_zones": [],
      "face_visibility": "profile"
    },
    {
      "action": "ult",
      "index": 1,
      "file": "frames/ult_01.png",
      "rect": [
        2338,
        0,
        59,
        53
      ],
      "bottom_margin": 6,
      "face_bbox": [
        30,
        21,
        9,
        12
      ],
      "eye_pixels": [
        [
          33,
          26
        ],
        [
          37,
          25
        ]
      ],
      "mask_bbox": [
        16,
        13,
        17,
        21
      ],
      "foot_zones": [],
      "face_visibility": "front"
    },
    {
      "action": "ult",
      "index": 2,
      "file": "frames/ult_02.png",
      "rect": [
        2398,
        0,
        59,
        57
      ],
      "bottom_margin": 8,
      "face_bbox": [
        28,
        23,
        7,
        7
      ],
      "eye_pixels": [
        [
          30,
          24
        ]
      ],
      "mask_bbox": [
        18,
        15,
        9,
        16
      ],
      "foot_zones": [],
      "face_visibility": "profile"
    },
    {
      "action": "ult",
      "index": 3,
      "file": "frames/ult_03.png",
      "rect": [
        2458,
        0,
        61,
        53
      ],
      "bottom_margin": 10,
      "face_bbox": [
        40,
        15,
        7,
        8
      ],
      "eye_pixels": [
        [
          42,
          18
        ]
      ],
      "mask_bbox": [
        26,
        8,
        14,
        15
      ],
      "foot_zones": [],
      "face_visibility": "profile"
    },
    {
      "action": "ult",
      "index": 4,
      "file": "frames/ult_04.png",
      "rect": [
        2520,
        0,
        51,
        51
      ],
      "bottom_margin": 12,
      "face_bbox": [
        34,
        13,
        9,
        9
      ],
      "eye_pixels": [
        [
          37,
          17
        ],
        [
          41,
          17
        ]
      ],
      "mask_bbox": [
        21,
        6,
        15,
        16
      ],
      "foot_zones": [],
      "face_visibility": "front"
    },
    {
      "action": "ult",
      "index": 5,
      "file": "frames/ult_05.png",
      "rect": [
        2572,
        0,
        59,
        47
      ],
      "bottom_margin": 11,
      "face_bbox": [
        36,
        11,
        7,
        10
      ],
      "eye_pixels": [
        [
          38,
          14
        ]
      ],
      "mask_bbox": [
        25,
        4,
        12,
        18
      ],
      "foot_zones": [],
      "face_visibility": "profile"
    },
    {
      "action": "ult",
      "index": 6,
      "file": "frames/ult_06.png",
      "rect": [
        2632,
        0,
        59,
        49
      ],
      "bottom_margin": 9,
      "face_bbox": [
        35,
        12,
        7,
        9
      ],
      "eye_pixels": [
        [
          37,
          16
        ]
      ],
      "mask_bbox": [
        22,
        5,
        14,
        17
      ],
      "foot_zones": [],
      "face_visibility": "profile"
    },
    {
      "action": "ult",
      "index": 7,
      "file": "frames/ult_07.png",
      "rect": [
        2692,
        0,
        61,
        53
      ],
      "bottom_margin": 7,
      "face_bbox": [
        30,
        17,
        7,
        8
      ],
      "eye_pixels": [
        [
          32,
          20
        ]
      ],
      "mask_bbox": [
        19,
        11,
        13,
        14
      ],
      "foot_zones": [],
      "face_visibility": "profile"
    },
    {
      "action": "ult",
      "index": 8,
      "file": "frames/ult_08.png",
      "rect": [
        2754,
        0,
        55,
        57
      ],
      "bottom_margin": 6,
      "face_bbox": [
        22,
        22,
        13,
        15
      ],
      "eye_pixels": [
        [
          23,
          28
        ],
        [
          33,
          28
        ]
      ],
      "mask_bbox": [
        16,
        16,
        10,
        22
      ],
      "foot_zones": [],
      "face_visibility": "front"
    },
    {
      "action": "ult",
      "index": 9,
      "file": "frames/ult_09.png",
      "rect": [
        2810,
        0,
        59,
        53
      ],